{"book_id": "chem-grade9-all-in-one", "title": "13_初中（五•四学制）_化学_沪科技版_九年级_全一册_（根据2022年版课程标准修订）义务教育教科书（五•四学制）•化学九年级全一册_e631b16a-511c-141e-d712-dbb39be61c2c", "source_path": "/Users/titan-frank/Documents/hsd/research/Knowledge/13_初中（五•四学制）_化学_沪科技版_九年级_全一册_（根据2022年版课程标准修订）义务教育教科书（五•四学制）•化学九年级全一册_e631b16a-511c-141e-d712-dbb39be61c2c.pdf", "generated_at": "2026-03-24T06:22:45.889754+00:00", "toc_pages": {"start": 1, "end": 20}, "items": [{"id": "struct:chem-grade9-all-in-one:theme:1", "kind": "theme", "label": "主题五", "title": "常见的物质（下）", "page_start": 1, "level": 1, "order_path": "1", "raw_line": "主题五      常见的物质（下）/ 1"}, {"id": "struct:chem-grade9-all-in-one:topic:1-1", "kind": "topic", "label": "专题 7", "title": "溶液", "page_start": 2, "level": 2, "order_path": "1.1", "raw_line": "专题 7       溶液 / 2", "parent_id": "struct:chem-grade9-all-in-one:theme:1"}, {"id": "struct:chem-grade9-all-in-one:lesson:1-1-1", "kind": "lesson", "label": "课题 1", "title": "初探溶液", "page_start": 3, "level": 3, "order_path": "1.1.1", "raw_line": "课题 1   初探溶液 / 3", "parent_id": "struct:chem-grade9-all-in-one:topic:1-1"}, {"id": "struct:chem-grade9-all-in-one:lesson:1-1-2", "kind": "lesson", "label": "课题 2", "title": "探究物质的溶解性", "page_start": 10, "level": 3, "order_path": "1.1.2", "raw_line": "课题 2 探究物质的溶解性 / 10", "parent_id": "struct:chem-grade9-all-in-one:topic:1-1"}, {"id": "struct:chem-grade9-all-in-one:lesson:1-1-3", "kind": "lesson", "label": "课题 3", "title": "学会定量表示溶液的组成", "page_start": 20, "level": 3, "order_path": "1.1.3", "raw_line": "课题 3 学会定量表示溶液的组成 / 20", "parent_id": "struct:chem-grade9-all-in-one:topic:1-1"}, {"id": "struct:chem-grade9-all-in-one:activity:1-1-4", "kind": "activity", "label": "跨学科实践活动", "title": "海洋资源的综合利用与制盐", "page_start": 26, "level": 3, "order_path": "1.1.4", "raw_line": "跨学科实践活动 海洋资源的综合利用与制盐 / 26", "parent_id": "struct:chem-grade9-all-in-one:topic:1-1"}, {"id": "struct:chem-grade9-all-in-one:review:1-1-5", "kind": "review", "label": "专题复习", "title": "专题复习", "page_start": 29, "level": 3, "order_path": "1.1.5", "raw_line": "专题复习 / 29", "parent_id": "struct:chem-grade9-all-in-one:topic:1-1"}, {"id": "struct:chem-grade9-all-in-one:topic:1-2", "kind": "topic", "label": "专题 8", "title": "酸、碱、盐", "page_start": 32, "level": 2, "order_path": "1.2", "raw_line": "专题 8       酸、碱、盐 / 32", "parent_id": "struct:chem-grade9-all-in-one:theme:1"}, {"id": "struct:chem-grade9-all-in-one:lesson:1-2-1", "kind": "lesson", "label": "课题 1", "title": "初识酸和碱", "page_start": 33, "level": 3, "order_path": "1.2.1", "raw_line": "课题 1   初识酸和碱 / 33", "parent_id": "struct:chem-grade9-all-in-one:topic:1-2"}, {"id": "struct:chem-grade9-all-in-one:lesson:1-2-2", "kind": "lesson", "label": "课题 2", "title": "认识酸、碱、盐的性质与应用", "page_start": 42, "level": 3, "order_path": "1.2.2", "raw_line": "课题 2 认识酸、碱、盐的性质与应用 / 42", "parent_id": "struct:chem-grade9-all-in-one:topic:1-2"}, {"id": "struct:chem-grade9-all-in-one:lesson:1-2-3", "kind": "lesson", "label": "课题 3", "title": "调节土壤酸碱性与施用营养元素", "page_start": 55, "level": 3, "order_path": "1.2.3", "raw_line": "课题 3 调节土壤酸碱性与施用营养元素 / 55", "parent_id": "struct:chem-grade9-all-in-one:topic:1-2"}, {"id": "struct:chem-grade9-all-in-one:review:1-2-4", "kind": "review", "label": "专题复习", "title": "专题复习", "page_start": 69, "level": 3, "order_path": "1.2.4", "raw_line": "专题复习 / 69", "parent_id": "struct:chem-grade9-all-in-one:topic:1-2"}, {"id": "struct:chem-grade9-all-in-one:theme:2", "kind": "theme", "label": "主题六", "title": "物质的化学变化（下）", "page_start": 73, "level": 1, "order_path": "2", "raw_line": "主题六      物质的化学变化（下）/ 73"}, {"id": "struct:chem-grade9-all-in-one:topic:2-1", "kind": "topic", "label": "专题 9", "title": "化学反应的调控", "page_start": 74, "level": 2, "order_path": "2.1", "raw_line": "专题 9     化学反应的调控 / 74", "parent_id": "struct:chem-grade9-all-in-one:theme:2"}, {"id": "struct:chem-grade9-all-in-one:lesson:2-1-1", "kind": "lesson", "label": "课题 1", "title": "认识燃烧与燃料", "page_start": 75, "level": 3, "order_path": "2.1.1", "raw_line": "课题 1   认识燃烧与燃料 / 75", "parent_id": "struct:chem-grade9-all-in-one:topic:2-1"}, {"id": "struct:chem-grade9-all-in-one:lesson:2-1-2", "kind": "lesson", "label": "课题 2", "title": "调控燃烧的方法", "page_start": 83, "level": 3, "order_path": "2.1.2", "raw_line": "课题 2 调控燃烧的方法 / 83", "parent_id": "struct:chem-grade9-all-in-one:topic:2-1"}, {"id": "struct:chem-grade9-all-in-one:lesson:2-1-3", "kind": "lesson", "label": "课题 3", "title": "防止金属腐蚀的措施", "page_start": 89, "level": 3, "order_path": "2.1.3", "raw_line": "课题 3 防止金属腐蚀的措施 / 89", "parent_id": "struct:chem-grade9-all-in-one:topic:2-1"}, {"id": "struct:chem-grade9-all-in-one:review:2-1-4", "kind": "review", "label": "专题复习", "title": "专题复习", "page_start": 101, "level": 3, "order_path": "2.1.4", "raw_line": "专题复习 / 101", "parent_id": "struct:chem-grade9-all-in-one:topic:2-1"}, {"id": "struct:chem-grade9-all-in-one:topic:2-2", "kind": "topic", "label": "专题 10", "title": "化学与人类社会进步", "page_start": 104, "level": 2, "order_path": "2.2", "raw_line": "专题 10    化学与人类社会进步 / 104", "parent_id": "struct:chem-grade9-all-in-one:theme:2"}, {"id": "struct:chem-grade9-all-in-one:lesson:2-2-1", "kind": "lesson", "label": "课题 1", "title": "化学引领新能源的开发", "page_start": 105, "level": 3, "order_path": "2.2.1", "raw_line": "课题 1   化学引领新能源的开发 / 105", "parent_id": "struct:chem-grade9-all-in-one:topic:2-2"}, {"id": "struct:chem-grade9-all-in-one:lesson:2-2-2", "kind": "lesson", "label": "课题 2", "title": "健康生活离不开化学", "page_start": 112, "level": 3, "order_path": "2.2.2", "raw_line": "课题 2 健康生活离不开化学 / 112", "parent_id": "struct:chem-grade9-all-in-one:topic:2-2"}, {"id": "struct:chem-grade9-all-in-one:lesson:2-2-3", "kind": "lesson", "label": "课题 3", "title": "化学为人类提供丰富的材料", "page_start": 120, "level": 3, "order_path": "2.2.3", "raw_line": "课题 3 化学为人类提供丰富的材料 / 120", "parent_id": "struct:chem-grade9-all-in-one:topic:2-2"}, {"id": "struct:chem-grade9-all-in-one:review:2-2-4", "kind": "review", "label": "专题复习", "title": "专题复习", "page_start": 137, "level": 3, "order_path": "2.2.4", "raw_line": "专题复习 / 137", "parent_id": "struct:chem-grade9-all-in-one:topic:2-2"}]}
